{
  "initialization_plan": {
    "steering_contract_status": "ready",
    "orchestration_decision_status": "route_ready",
    "requested_outputs": [
      "AGENTS.md",
      "PROGRESS.md",
      "feature_registry.json",
      "docs/project_overview.md",
      "docs/workflow_overview.md",
      "docs/approval_policy.md",
      "scripts/validate_harness_structure.py",
      ".harness/state/workflow_state.json",
      ".harness/state/initialization_manifest.json"
    ],
    "allowed_outputs": [
      "AGENTS.md",
      "PROGRESS.md",
      "feature_registry.json",
      "docs/project_overview.md",
      "docs/workflow_overview.md",
      "docs/approval_policy.md",
      "scripts/validate_harness_structure.py",
      ".harness/state/workflow_state.json",
      ".harness/state/initialization_manifest.json"
    ],
    "files_to_create": [
      "AGENTS.md",
      "PROGRESS.md",
      "feature_registry.json",
      "docs/project_overview.md",
      "docs/workflow_overview.md",
      "docs/approval_policy.md",
      "scripts/validate_harness_structure.py",
      ".harness/state/workflow_state.json",
      ".harness/state/initialization_manifest.json"
    ],
    "files_to_skip": [],
    "files_to_block": [],
    "approval_check": "No approval-gated overwrite or out-of-scope output is requested.",
    "validation_plan": [
      "Verify expected scaffold files exist",
      "Verify feature_registry.json is parseable and has an empty features array",
      "Verify no forbidden runtime outputs were created"
    ]
  },
  "created_files": [
    {
      "path": "AGENTS.md",
      "reason": "Root agent operating guide for harness workflow rules"
    },
    {
      "path": "PROGRESS.md",
      "reason": "Root progress tracking placeholder"
    },
    {
      "path": "feature_registry.json",
      "reason": "Empty feature registry with no backlog items"
    },
    {
      "path": "docs/project_overview.md",
      "reason": "Project overview placeholder derived from the steering contract"
    },
    {
      "path": "docs/workflow_overview.md",
      "reason": "Harness workflow overview placeholder"
    },
    {
      "path": "docs/approval_policy.md",
      "reason": "Human approval policy placeholder"
    },
    {
      "path": "scripts/validate_harness_structure.py",
      "reason": "Standard-library read-only scaffold validation script"
    },
    {
      "path": ".harness/state/workflow_state.json",
      "reason": "Machine-readable workflow state for orchestrator routing"
    },
    {
      "path": ".harness/state/initialization_manifest.json",
      "reason": "Machine-readable manifest of initialization results"
    }
  ],
  "skipped_files": [],
  "blocked_files": [],
  "file_manifest": [
    {
      "path": "AGENTS.md",
      "action": "create",
      "purpose": "Root agent operating guide",
      "source_template": "templates/project_files/AGENTS.md",
      "approval_required": false
    },
    {
      "path": "PROGRESS.md",
      "action": "create",
      "purpose": "Progress tracking placeholder",
      "source_template": "templates/project_files/PROGRESS.md",
      "approval_required": false
    },
    {
      "path": "feature_registry.json",
      "action": "create",
      "purpose": "Empty feature registry",
      "source_template": "templates/project_files/feature_registry.json",
      "approval_required": false
    },
    {
      "path": "docs/project_overview.md",
      "action": "create",
      "purpose": "Project overview placeholder",
      "source_template": "templates/project_files/docs/project_overview.md",
      "approval_required": false
    },
    {
      "path": "docs/workflow_overview.md",
      "action": "create",
      "purpose": "Workflow overview placeholder",
      "source_template": "templates/project_files/docs/workflow_overview.md",
      "approval_required": false
    },
    {
      "path": "docs/approval_policy.md",
      "action": "create",
      "purpose": "Approval policy placeholder",
      "source_template": "templates/project_files/docs/approval_policy.md",
      "approval_required": false
    },
    {
      "path": "scripts/validate_harness_structure.py",
      "action": "create",
      "purpose": "Read-only scaffold validation script",
      "source_template": "templates/project_files/scripts/validate_harness_structure.py",
      "approval_required": false
    },
    {
      "path": ".harness/state/workflow_state.json",
      "action": "create",
      "purpose": "Workflow state record",
      "source_template": "generated",
      "approval_required": false
    },
    {
      "path": ".harness/state/initialization_manifest.json",
      "action": "create",
      "purpose": "Initialization manifest",
      "source_template": "generated",
      "approval_required": false
    }
  ],
  "validation_results": {
    "passed": true,
    "checks": [
      {
        "name": "allowed_outputs_only",
        "passed": true,
        "message": "All created files are within the allowed runtime scope."
      },
      {
        "name": "empty_feature_registry",
        "passed": true,
        "message": "feature_registry.json contains an empty features array."
      },
      {
        "name": "no_later_agents_created",
        "passed": true,
        "message": "No later agent directories were created."
      }
    ]
  },
  "initialization_report": {
    "summary": "Initialized the minimal non-business harness scaffold and created no feature backlog items.",
    "created_count": 9,
    "skipped_count": 0,
    "blocked_count": 0,
    "remaining_blockers": []
  },
  "workflow_state_update": {
    "current_phase": "repository_mapping",
    "completed_agents": [
      "human_steering",
      "harness_orchestrator",
      "initializer_agent"
    ],
    "pending_agents": [
      "repo_cartographer"
    ],
    "blockers": [],
    "next_decision_needed": "harness_orchestrator should review initialization output and decide whether to route to repo_cartographer."
  },
  "initialization_manifest": {
    "schema_version": "1.0",
    "initialized_by": "initializer_agent",
    "created_files": [
      "AGENTS.md",
      "PROGRESS.md",
      "feature_registry.json",
      "docs/project_overview.md",
      "docs/workflow_overview.md",
      "docs/approval_policy.md",
      "scripts/validate_harness_structure.py",
      ".harness/state/workflow_state.json",
      ".harness/state/initialization_manifest.json"
    ],
    "skipped_files": [],
    "blocked_files": []
  },
  "handoff_summary": {
    "current_status": "initialized",
    "initialization_completed": true,
    "recommended_next_agent": "harness_orchestrator",
    "suggested_next_phase": "repository_mapping",
    "notes_for_harness_orchestrator": [
      "Review the initialization manifest before routing.",
      "Do not invoke repo_cartographer directly from initializer_agent output."
    ]
  },
  "recommended_next_agent": "harness_orchestrator",
  "suggested_next_phase": "repository_mapping",
  "requires_human_approval": false,
  "approval_reason": "",
  "blocked_reason": "",
  "status": "initialized"
}
